{
  "key": "art-asset",
  "title": "Art Assets",
  "order": 7,
  "description": "The artists, studios and published works the original site drew its imagery from. The archive recorded these as one list and never recorded which picture came from which name, so this page can credit the pool but cannot yet credit any single image to anyone in it.",
  "note": "Listed alphabetically, as the original credits listed them."
}
